Sheet: Sheet1
A1: Name | B1: Units | C1: Value | D1: Value | E1: Difference
A2: Edge energy | B2: eV | C2: 6539 | D2: 6540
A3: Monochromator energy | B3: eV | C3: 6574 | D3: of:=[.D4]+[.D2] -> 7001.01 | E3: of:=[.D3]-[.C3] -> 427.01
A4: Photoelectron energy | B4: eV | C4: of:=[.C3]-[.C2] -> 35 | D4: of:=3.81*POWER([.D5];2) -> 461.01 | E4: of:=[.D4]-[.C4] -> 426.01
A5: k | B5: â„«-1 | C5: of:=SQRT([.C4]*0.262) -> 3.02820078594534 | D5: 11 | E5: of:=[.D5]-[.C5] -> 7.97179921405466